{"issuer":"https://api.garl.ai","runtime":"claude-code","version":"garl/action-receipt/v0.1","protocol":"github","signature":"39cf3dc8179558950e81b215cd7ae42d84418fda037bbd943078a3fcceaa83b32c4947a7d2064e7f8928b38c9e727976348422600f8566063b947428accad489","timestamp":"2026-08-03T20:35:25.957668Z","input_hash":"19829e3e342ae1b2e2af4aa8179542e2c9c5c325a025020294c1ab332599a120","receipt_id":"4c582da1-563b-449b-bb6e-c2514ebec2fd","action_type":"code_write","output_hash":"ebd01c50e8af1f39a2656fe6541ef24eacef07d2c88d9856a31145c505679be1","side_effect":"reversible","tool_server":null,"attestations":["garl-trace:12ff0e8f-a679-4aba-a422-319b2bc45442"],"agent_identity":"did:garl:fac1597f-34d1-4ee3-ba8d-5805bc22b5ca","human_delegate":null,"verification_key_id":"8c6e8f25ef3bf704"}