{"issuer":"https://api.garl.ai","runtime":"claude-code","version":"garl/action-receipt/v0.1","protocol":"github","signature":"191007547eba04af91dc0e8f723bb82bd7bf42ceb11d44d72d3c087d3d1432e662a24a292460e69ed63329d0b2127d84adc295cae6a18e7ae00ffb455d8e2543","timestamp":"2026-08-03T21:01:50.192667Z","input_hash":"9212fcbd5e0450063e8dda9625b5ed50c91b041c249a8cf7b6c061a1ffe72879","receipt_id":"c28b2f94-4365-4742-8a40-05764ac1fdac","action_type":"code_write","output_hash":"2b34c9a918184e8ac18fd398dfc697fd41a36c4e0a3491e2baac56faed34eae5","side_effect":"reversible","tool_server":null,"attestations":["garl-trace:28a153a3-eda4-41e2-8138-a1229e44ed3a"],"agent_identity":"did:garl:fac1597f-34d1-4ee3-ba8d-5805bc22b5ca","human_delegate":null,"verification_key_id":"8c6e8f25ef3bf704"}