{"issuer":"https://api.garl.ai","runtime":"claude-code","version":"garl/action-receipt/v0.1","protocol":"github","signature":"da04b6bd9fbca153f37dd0c78fae6902904adf25c46259510b032315218be6c977529b394211057d00e2626386bd9c055681027effea1e9d962253873579086e","timestamp":"2026-07-13T11:50:26.380410Z","input_hash":"c50e3899ff67a3d66375323cecd83efde8510a0d52f740f64fbc16e9662ba075","receipt_id":"0a4e3e31-efb5-46e3-a1f5-2ff8e9bb51b9","action_type":"code_write","output_hash":"8e22268fa126e72bea7431b11c89256f105df6befeecf15cd32847d56c822bfc","side_effect":"reversible","tool_server":null,"attestations":["garl-trace:b4ed8ddd-40b0-4d50-aac0-055e3ae15494"],"agent_identity":"did:garl:780e900c-f429-41ee-8c9b-078f6bc5153b","human_delegate":null,"verification_key_id":"8c6e8f25ef3bf704"}