{"issuer":"https://api.garl.ai","runtime":"claude-code","version":"garl/action-receipt/v0.1","protocol":"github","signature":"2702c85aadc526bd8d391d679efda902e48670e9c93e4dc6e1fe9ba59a0334061748efb91adecb60bc3359872bc3328dd864b0a85a6b4c613524e46923e6a530","timestamp":"2026-07-13T12:26:14.326009Z","input_hash":"e91b1e744b62bbc7b9e5f28eb4501bfefc1dd9edc4f5383a026da0aa0a230d7e","receipt_id":"bedfd8a6-30a6-494f-a279-98f435067b11","action_type":"code_write","output_hash":"a0081253a5fe3605491f0307e115303eb3fa3ce62c529bc5d7132f0b0971e31d","side_effect":"reversible","tool_server":null,"attestations":["garl-trace:0be7744f-a6dc-4786-8042-013ebd2f9c9c"],"agent_identity":"did:garl:fac1597f-34d1-4ee3-ba8d-5805bc22b5ca","human_delegate":null,"verification_key_id":"8c6e8f25ef3bf704"}