{"issuer":"https://api.garl.ai","runtime":"claude-code","version":"garl/action-receipt/v0.1","protocol":"github","signature":"3a67b68a0afcfccf0a7ceb31fc99b2ae43938a77eccea35aed39cbea5def480d11ff51b91c2965ee233d3221e0f18b23689606a7abb0a72dae86d58866acbb2c","timestamp":"2026-08-03T20:29:04.707501Z","input_hash":"5bcd1b602440695d822c3faaed2f304f58c6cd449711a0c71f7a88ac8e7b4640","receipt_id":"7a3dd4c7-13fc-4ae2-84d9-3f04931ef58f","action_type":"code_write","output_hash":"d4675e14875dfa537d0e36d1b4e4bba85bd99703c249ecf0d9d40e0fd6b85ae4","side_effect":"reversible","tool_server":null,"attestations":["garl-trace:c3b689af-ae17-45cb-a466-eb246d3c398d"],"agent_identity":"did:garl:fac1597f-34d1-4ee3-ba8d-5805bc22b5ca","human_delegate":null,"verification_key_id":"8c6e8f25ef3bf704"}